# This is the output of cat /proc/asound/card0/codec#0 

Codec: Realtek ALC298
Address: 0
AFG Function Id: 0x1 (unsol 1)
Vendor Id: 0x10ec0298
Subsystem Id: 0x144dca07
Revision Id: 0x100103
No Modem Function Group found
Default PCM:
    rates [0x560]: 44100 48000 96000 192000
    bits [0xe]: 16 20 24
    formats [0x1]: PCM
Default Amp-In caps: N/A
Default Amp-Out caps: N/A
State of AFG node 0x01:
  Power states:  D0 D1 D2 D3 D3cold CLKSTOP EPSS
  Power: setting=D0, actual=D0
GPIO: io=8, o=0, i=0, unsolicited=1, wake=0
  IO[0]: enable=0, dir=0, wake=0, sticky=0, data=0, unsol=0
  IO[1]: enable=0, dir=0, wake=0, sticky=0, data=0, unsol=0
  IO[2]: enable=0, dir=0, wake=0, sticky=0, data=0, unsol=0
  IO[3]: enable=0, dir=0, wake=0, sticky=0, data=0, unsol=0
  IO[4]: enable=0, dir=0, wake=0, sticky=0, data=0, unsol=0
  IO[5]: enable=0, dir=0, wake=0, sticky=0, data=0, unsol=0
  IO[6]: enable=0, dir=0, wake=0, sticky=0, data=0, unsol=0
  IO[7]: enable=0, dir=0, wake=0, sticky=0, data=0, unsol=0
Node 0x02 [Audio Output] wcaps 0x41d: Stereo Amp-Out
  Control: name="Headphone Playback Volume", index=0, device=0
    ControlAmp: chs=3, dir=Out, idx=0, ofs=0
  Amp-Out caps: ofs=0x7f, nsteps=0x7f, stepsize=0x01, mute=0
  Amp-Out vals:  [0x7f 0x7f]
  Converter: stream=0, channel=0
  PCM:
    rates [0x560]: 44100 48000 96000 192000
    bits [0xe]: 16 20 24
    formats [0x1]: PCM
  Power states:  D0 D1 D2 D3 EPSS
  Power: setting=D0, actual=D0
Node 0x03 [Audio Output] wcaps 0x41d: Stereo Amp-Out
  Control: name="Speaker Playback Volume", index=0, device=0
    ControlAmp: chs=3, dir=Out, idx=0, ofs=0
  Amp-Out caps: ofs=0x7f, nsteps=0x7f, stepsize=0x01, mute=0
  Amp-Out vals:  [0x5c 0x5c]
  Converter: stream=0, channel=0
  PCM:
    rates [0x560]: 44100 48000 96000 192000
    bits [0xe]: 16 20 24
    formats [0x1]: PCM
  Power states:  D0 D1 D2 D3 EPSS
  Power: setting=D0, actual=D0
Node 0x04 [Vendor Defined Widget] wcaps 0xf00000: Mono
Node 0x05 [Vendor Defined Widget] wcaps 0xf00000: Mono
Node 0x06 [Audio Output] wcaps 0x611: Stereo Digital
  Converter: stream=0, channel=0
  Digital:
  Digital category: 0x0
  IEC Coding Type: 0x0
  PCM:
    rates [0x40]: 48000
    bits [0xe]: 16 20 24
    formats [0x1]: PCM
  Power states:  D0 D1 D2 D3 EPSS
  Power: setting=D0, actual=D0
Node 0x07 [Vendor Defined Widget] wcaps 0xf00000: Mono
Node 0x08 [Audio Input] wcaps 0x10051b: Stereo Amp-In
  Control: name="Capture Volume", index=0, device=0
    ControlAmp: chs=3, dir=In, idx=0, ofs=0
  Control: name="Capture Switch", index=0, device=0
    ControlAmp: chs=3, dir=In, idx=0, ofs=0
  Amp-In caps: ofs=0x43, nsteps=0x7f, stepsize=0x01, mute=1
  Amp-In vals:  [0x4c 0x4c]
  Converter: stream=0, channel=0
  SDI-Select: 0
  PCM:
    rates [0x60]: 44100 48000
    bits [0xe]: 16 20 24
    formats [0x1]: PCM
  Power states:  D0 D1 D2 D3 EPSS
  Power: setting=D0, actual=D0
  Connection: 1
     0x23
Node 0x09 [Audio Input] wcaps 0x10051b: Stereo Amp-In
  Amp-In caps: ofs=0x43, nsteps=0x7f, stepsize=0x01, mute=1
  Amp-In vals:  [0xc3 0xc3]
  Converter: stream=0, channel=0
  SDI-Select: 0
  PCM:
    rates [0x60]: 44100 48000
    bits [0xe]: 16 20 24
    formats [0x1]: PCM
  Power states:  D0 D1 D2 D3 EPSS
  Power: setting=D0, actual=D0
  Connection: 1
     0x22
Node 0x0a [Audio Input] wcaps 0x100511: Stereo
  Converter: stream=0, channel=0
  SDI-Select: 0
  PCM:
    rates [0x40]: 48000
    bits [0xe]: 16 20 24
    formats [0x1]: PCM
  Power states:  D0 D1 D2 D3 EPSS
  Power: setting=D0, actual=D0
  Connection: 1
     0x25
Node 0x0b [Audio Mixer] wcaps 0x20010b: Stereo Amp-In
  Control: name="Mic Playback Volume", index=0, device=0
    ControlAmp: chs=3, dir=In, idx=0, ofs=0
  Control: name="Mic Playback Switch", index=0, device=0
    ControlAmp: chs=3, dir=In, idx=0, ofs=0
  Amp-In caps: ofs=0x17, nsteps=0x1f, stepsize=0x05, mute=1
  Amp-In vals:  [0x80 0x80] [0x80 0x80] [0x80 0x80] [0x80 0x80]
  Connection: 4
     0x18 0x19 0x1a 0x1d
Node 0x0c [Audio Mixer] wcaps 0x20010b: Stereo Amp-In
  Amp-In caps: ofs=0x00, nsteps=0x00, stepsize=0x00, mute=1
  Amp-In vals:  [0x00 0x00] [0x80 0x80]
  Connection: 2
     0x02 0x0b
Node 0x0d [Audio Mixer] wcaps 0x20010b: Stereo Amp-In
  Amp-In caps: ofs=0x00, nsteps=0x00, stepsize=0x00, mute=1
  Amp-In vals:  [0x00 0x00]
  Connection: 1
     0x03
Node 0x0e [Vendor Defined Widget] wcaps 0xf00000: Mono
Node 0x0f [Vendor Defined Widget] wcaps 0xf00000: Mono
Node 0x10 [Vendor Defined Widget] wcaps 0xf00000: Mono
Node 0x11 [Audio Input] wcaps 0x10051b: Stereo Amp-In
  Amp-In caps: ofs=0x43, nsteps=0x7f, stepsize=0x01, mute=1
  Amp-In vals:  [0xc3 0xc3]
  Converter: stream=0, channel=0
  SDI-Select: 0
  PCM:
    rates [0x60]: 44100 48000
    bits [0xe]: 16 20 24
    formats [0x1]: PCM
  Power states:  D0 D1 D2 D3 EPSS
  Power: setting=D0, actual=D0
  Connection: 1
     0x24
Node 0x12 [Pin Complex] wcaps 0x40040b: Stereo Amp-In
  Amp-In caps: ofs=0x00, nsteps=0x03, stepsize=0x27, mute=0
  Amp-In vals:  [0x00 0x00]
  Pincap 0x00000020: IN
  Pin Default 0x411111f0: [N/A] Speaker at Ext Rear
    Conn = 1/8, Color = Black
    DefAssociation = 0xf, Sequence = 0x0
    Misc = NO_PRESENCE
  Pin-ctls: 0x00:
  Power states:  D0 D1 D2 D3 EPSS
  Power: setting=D0, actual=D0
Node 0x13 [Pin Complex] wcaps 0x40040b: Stereo Amp-In
  Amp-In caps: ofs=0x00, nsteps=0x03, stepsize=0x27, mute=0
  Amp-In vals:  [0x00 0x00]
  Pincap 0x00000020: IN
  Pin Default 0x40000000: [N/A] Line Out at Ext N/A
    Conn = Unknown, Color = Unknown
    DefAssociation = 0x0, Sequence = 0x0
  Pin-ctls: 0x00:
  Power states:  D0 D1 D2 D3 EPSS
  Power: setting=D0, actual=D0
Node 0x14 [Pin Complex] wcaps 0x40050d: Stereo Amp-Out
  Amp-Out caps: ofs=0x00, nsteps=0x00, stepsize=0x00, mute=1
  Amp-Out vals:  [0x80 0x80]
  Pincap 0x00010010: OUT EAPD
  EAPD 0x2: EAPD
  Pin Default 0x411111f0: [N/A] Speaker at Ext Rear
    Conn = 1/8, Color = Black
    DefAssociation = 0xf, Sequence = 0x0
    Misc = NO_PRESENCE
  Pin-ctls: 0x00:
  Power states:  D0 D1 D2 D3 EPSS
  Power: setting=D0, actual=D0
  Connection: 2
     0x0c* 0x0d
Node 0x15 [Vendor Defined Widget] wcaps 0xf00000: Mono
Node 0x16 [Vendor Defined Widget] wcaps 0xf00000: Mono
Node 0x17 [Pin Complex] wcaps 0x40058d: Stereo Amp-Out
  Control: name="Speaker Playback Switch", index=0, device=0
    ControlAmp: chs=3, dir=Out, idx=0, ofs=0
  Amp-Out caps: ofs=0x00, nsteps=0x00, stepsize=0x00, mute=1
  Amp-Out vals:  [0x00 0x00]
  Pincap 0x0001001c: OUT HP EAPD Detect
  EAPD 0x2: EAPD
  Pin Default 0x90170110: [Fixed] Speaker at Int N/A
    Conn = Analog, Color = Unknown
    DefAssociation = 0x1, Sequence = 0x0
    Misc = NO_PRESENCE
  Pin-ctls: 0x40: OUT
  Unsolicited: tag=00, enabled=0
  Power states:  D0 D1 D2 D3 EPSS
  Power: setting=D0, actual=D0
  Connection: 3
     0x0c 0x0d* 0x06
Node 0x18 [Pin Complex] wcaps 0x40048b: Stereo Amp-In
  Control: name="Mic Boost Volume", index=0, device=0
    ControlAmp: chs=3, dir=In, idx=0, ofs=0
  Amp-In caps: ofs=0x00, nsteps=0x03, stepsize=0x27, mute=0
  Amp-In vals:  [0x00 0x00]
  Pincap 0x00003724: IN Detect
    Vref caps: HIZ 50 GRD 80 100
  Pin Default 0x04a11020: [Jack] Mic at Ext Right
    Conn = 1/8, Color = Black
    DefAssociation = 0x2, Sequence = 0x0
  Pin-ctls: 0x24: IN VREF_80
  Unsolicited: tag=02, enabled=1
  Power states:  D0 D1 D2 D3 EPSS
  Power: setting=D0, actual=D0
Node 0x19 [Pin Complex] wcaps 0x40048b: Stereo Amp-In
  Amp-In caps: ofs=0x00, nsteps=0x03, stepsize=0x27, mute=0
  Amp-In vals:  [0x00 0x00]
  Pincap 0x00003724: IN Detect
    Vref caps: HIZ 50 GRD 80 100
  Pin Default 0x411111f0: [N/A] Speaker at Ext Rear
    Conn = 1/8, Color = Black
    DefAssociation = 0xf, Sequence = 0x0
    Misc = NO_PRESENCE
  Pin-ctls: 0x00: VREF_HIZ
  Unsolicited: tag=00, enabled=0
  Power states:  D0 D1 D2 D3 EPSS
  Power: setting=D0, actual=D0
Node 0x1a [Pin Complex] wcaps 0x40058f: Stereo Amp-In Amp-Out
  Amp-In caps: ofs=0x00, nsteps=0x03, stepsize=0x27, mute=0
  Amp-In vals:  [0x00 0x00]
  Amp-Out caps: ofs=0x00, nsteps=0x00, stepsize=0x00, mute=1
  Amp-Out vals:  [0x80 0x80]
  Pincap 0x0001373c: IN OUT HP EAPD Detect
    Vref caps: HIZ 50 GRD 80 100
  EAPD 0x2: EAPD
  Pin Default 0x411111f0: [N/A] Speaker at Ext Rear
    Conn = 1/8, Color = Black
    DefAssociation = 0xf, Sequence = 0x0
    Misc = NO_PRESENCE
  Pin-ctls: 0x00: VREF_HIZ
  Unsolicited: tag=00, enabled=0
  Power states:  D0 D1 D2 D3 EPSS
  Power: setting=D0, actual=D0
  Connection: 2
     0x0c* 0x0d
Node 0x1b [Vendor Defined Widget] wcaps 0xf00000: Mono
Node 0x1c [Vendor Defined Widget] wcaps 0xf00000: Mono
Node 0x1d [Pin Complex] wcaps 0x400400: Mono
  Pincap 0x00000020: IN
  Pin Default 0x40630245: [N/A] Modem Line at Ext N/A
    Conn = ATAPI, Color = Unknown
    DefAssociation = 0x4, Sequence = 0x5
  Pin-ctls: 0x20: IN
  Power states:  D0 D1 D2 D3 EPSS
  Power: setting=D0, actual=D0
Node 0x1e [Pin Complex] wcaps 0x400701: Stereo Digital
  Pincap 0x00000014: OUT Detect
  Pin Default 0x411111f0: [N/A] Speaker at Ext Rear
    Conn = 1/8, Color = Black
    DefAssociation = 0xf, Sequence = 0x0
    Misc = NO_PRESENCE
  Pin-ctls: 0x00:
  Power states:  D0 D1 D2 D3 EPSS
  Power: setting=D0, actual=D0
  Connection: 1
     0x06
Node 0x1f [Pin Complex] wcaps 0x400401: Stereo
  Pincap 0x00000024: IN Detect
  Pin Default 0x411111f0: [N/A] Speaker at Ext Rear
    Conn = 1/8, Color = Black
    DefAssociation = 0xf, Sequence = 0x0
    Misc = NO_PRESENCE
  Pin-ctls: 0x00:
  Power states:  D0 D1 D2 D3 EPSS
  Power: setting=D0, actual=D0
Node 0x20 [Vendor Defined Widget] wcaps 0xf00040: Mono
  Processing caps: benign=0, ncoeff=150
    Coeff 0x00: 0x4013
    Coeff 0x01: 0xa5a8
    Coeff 0x02: 0x8e95
    Coeff 0x03: 0x0042
    Coeff 0x04: 0xaf67
    Coeff 0x05: 0x2be0
    Coeff 0x06: 0x1100
    Coeff 0x07: 0x0200
    Coeff 0x08: 0x2fcf
    Coeff 0x09: 0xd010
    Coeff 0x0a: 0x0100
    Coeff 0x0b: 0x0000
    Coeff 0x0c: 0x011e
    Coeff 0x0d: 0x2800
    Coeff 0x0e: 0x6f80
    Coeff 0x0f: 0x0062
    Coeff 0x10: 0x0c21
    Coeff 0x11: 0x7418
    Coeff 0x12: 0xe3c0
    Coeff 0x13: 0x242f
    Coeff 0x14: 0x2c60
    Coeff 0x15: 0x8ccc
    Coeff 0x16: 0x0018
    Coeff 0x17: 0xff00
    Coeff 0x18: 0x0003
    Coeff 0x19: 0x0017
    Coeff 0x1a: 0xc000
    Coeff 0x1b: 0x0068
    Coeff 0x1c: 0x0000
    Coeff 0x1d: 0x0000
    Coeff 0x1e: 0x0000
    Coeff 0x1f: 0x0000
    Coeff 0x20: 0x0020
    Coeff 0x21: 0x8847
    Coeff 0x22: 0x0000
    Coeff 0x23: 0x0000
    Coeff 0x24: 0x0000
    Coeff 0x25: 0x0000
    Coeff 0x26: 0x3000
    Coeff 0x27: 0x0000
    Coeff 0x28: 0x0000
    Coeff 0x29: 0x0000
    Coeff 0x2a: 0x0f08
    Coeff 0x2b: 0x0c10
    Coeff 0x2c: 0x000d
    Coeff 0x2d: 0xc020
    Coeff 0x2e: 0x0250
    Coeff 0x2f: 0x404c
    Coeff 0x30: 0x2421
    Coeff 0x31: 0x0000
    Coeff 0x32: 0x3f00
    Coeff 0x33: 0x0208
    Coeff 0x34: 0x5614
    Coeff 0x35: 0x1aa5
    Coeff 0x36: 0x6ac0
    Coeff 0x37: 0x1000
    Coeff 0x38: 0x04c1
    Coeff 0x39: 0x7418
    Coeff 0x3a: 0xe800
    Coeff 0x3b: 0x223e
    Coeff 0x3c: 0x0c60
    Coeff 0x3d: 0x8ccc
    Coeff 0x3e: 0x0858
    Coeff 0x3f: 0x00ff
    Coeff 0x40: 0x41ff
    Coeff 0x41: 0xff00
    Coeff 0x42: 0x0003
    Coeff 0x43: 0x0520
    Coeff 0x44: 0x0000
    Coeff 0x45: 0x0000
    Coeff 0x46: 0x0300
    Coeff 0x47: 0x8010
    Coeff 0x48: 0x0000
    Coeff 0x49: 0x4004
    Coeff 0x4a: 0x1012
    Coeff 0x4b: 0x3401
    Coeff 0x4c: 0x0910
    Coeff 0x4d: 0x0400
    Coeff 0x4e: 0x43fe
    Coeff 0x4f: 0xb029
    Coeff 0x50: 0x1000
    Coeff 0x51: 0x9420
    Coeff 0x52: 0x50c9
    Coeff 0x53: 0x0496
    Coeff 0x54: 0xcf00
    Coeff 0x55: 0x8000
    Coeff 0x56: 0x001e
    Coeff 0x57: 0x0004
    Coeff 0x58: 0x0000
    Coeff 0x59: 0x0000
    Coeff 0x5a: 0x0000
    Coeff 0x5b: 0x0000
    Coeff 0x5c: 0x0000
    Coeff 0x5d: 0x0030
    Coeff 0x5e: 0x3fff
    Coeff 0x5f: 0x1ca7
    Coeff 0x60: 0x0f99
    Coeff 0x61: 0xad65
    Coeff 0x62: 0xafe7
    Coeff 0x63: 0x1b02
    Coeff 0x64: 0x7f01
    Coeff 0x65: 0x0095
    Coeff 0x66: 0x0404
    Coeff 0x67: 0x1111
    Coeff 0x68: 0x1016
    Coeff 0x69: 0x273f
    Coeff 0x6a: 0x30aa
    Coeff 0x6b: 0x7006
    Coeff 0x6c: 0xfc05
    Coeff 0x6d: 0x6908
    Coeff 0x6e: 0x110a
    Coeff 0x6f: 0x0010
    Coeff 0x70: 0x60d8
    Coeff 0x71: 0x00d4
    Coeff 0x72: 0xc23a
    Coeff 0x73: 0xaa28
    Coeff 0x74: 0x8001
    Coeff 0x75: 0xc802
    Coeff 0x76: 0x0000
    Coeff 0x77: 0x207e
    Coeff 0x78: 0xa000
    Coeff 0x79: 0x6ac0
    Coeff 0x7a: 0x0000
    Coeff 0x7b: 0x0000
    Coeff 0x7c: 0x0000
    Coeff 0x7d: 0x03c8
    Coeff 0x7e: 0x2028
    Coeff 0x7f: 0xf008
    Coeff 0x80: 0x0011
    Coeff 0x81: 0x5fc0
    Coeff 0x82: 0x4408
    Coeff 0x83: 0x1641
    Coeff 0x84: 0x31bb
    Coeff 0x85: 0x0000
    Coeff 0x86: 0x0193
    Coeff 0x87: 0x0193
    Coeff 0x88: 0xa0a0
    Coeff 0x89: 0x0000
    Coeff 0x8a: 0x0008
    Coeff 0x8b: 0x06fc
    Coeff 0x8c: 0x3aff
    Coeff 0x8d: 0x0000
    Coeff 0x8e: 0x0000
    Coeff 0x8f: 0x1008
    Coeff 0x90: 0x002f
    Coeff 0x91: 0x0077
    Coeff 0x92: 0x0000
    Coeff 0x93: 0x0cd0
    Coeff 0x94: 0x0001
    Coeff 0x95: 0x4aa0
Node 0x21 [Pin Complex] wcaps 0x40058d: Stereo Amp-Out
  Control: name="Headphone Playback Switch", index=0, device=0
    ControlAmp: chs=3, dir=Out, idx=0, ofs=0
  Amp-Out caps: ofs=0x00, nsteps=0x00, stepsize=0x00, mute=1
  Amp-Out vals:  [0x80 0x80]
  Pincap 0x0000001c: OUT HP Detect
  Pin Default 0x04211050: [Jack] HP Out at Ext Right
    Conn = 1/8, Color = Black
    DefAssociation = 0x5, Sequence = 0x0
  Pin-ctls: 0xc0: OUT HP
  Unsolicited: tag=01, enabled=1
  Power states:  D0 D1 D2 D3 EPSS
  Power: setting=D0, actual=D0
  Connection: 2
     0x0c* 0x0d
Node 0x22 [Audio Selector] wcaps 0x300101: Stereo
  Connection: 6
     0x18* 0x19 0x1a 0x1d 0x0b 0x12
Node 0x23 [Audio Selector] wcaps 0x300101: Stereo
  Connection: 6
     0x18* 0x19 0x1a 0x1d 0x0b 0x13
Node 0x24 [Audio Selector] wcaps 0x300101: Stereo
  Connection: 2
     0x12* 0x13
Node 0x25 [Audio Selector] wcaps 0x300101: Stereo
  Connection: 1
     0x1f
`